idiom,definition
pass up like a white chip,To reject or ignore; to treat as worthless.
pert as a pearmonger,Very pert.
phony as a three-dollar bill,Extremely phony; fake; dishonest; completely bogus.
pissed as a fart,Very drunk.
pissed as a newt,Drunk to the point of incapacity; inebriated.
pissed as a parrot,Very drunk.
plain as day,Very clear and evident.
plain as porridge,Very clear and evident.
playful as a kitten,Very playful
plenty as blackberries,"Very plentiful, very abundant."
poor as a barber's cat,Very poor (lacking money).
poor as a church mouse,"Very poor, to the point of starving or begging; utterly destitute."
pretty as a picture,Very visually attractive.
pretty as a speckled pup,Very pretty.
proud as a peacock,Extremely proud.
pure as the driven snow,"Extremely pure; totally pure (typically ""pure"" in the sense of ""virtuous"")."
quack like a duck,To appear to be exactly what one is.
queer as a clockwork orange,"Strange, odd, unusual."
queer as a coot,Ostentatiously homosexual.
quick as a flash,Extremely quick.
quick as a wink,In a speedy or fast manner.
quick as lightning,Extremely quick.
quick as thought,Very quick.
quicker than scat,"very quickly, in a great hurry."
quiet as a grave,Very quiet
quiet as a mouse,"Very quiet, so as to not be heard."
rare as a four-leaf clover,Exceptionally rare.
rare as hen's teeth,Extremely uncommon.
rare as rocking horse shit,Extremely rare or scarce.
read like a book,"To be able to discern someone's thoughts from their body language or other behavior, especially in great detail and with little effort."
red as a beetroot,Bright red in colour; used of the human face when a person is embarrassed.
red as a lobster,"Bright red in color, especially from a bad sunburn."
red rag to a bull,Something that will enrage another particular person.
remember like it was yesterday,"to remember very well, especially something that happened long ago"
right as a trivet,In a perfect state; thoroughly sound.
right as ninepence,Perfectly all right; in sound condition.
right as rain,Very good; all in order; healthy.
run for the exercise,To run for political office with little chance of success.
run like a dry creek,To run for political office with little chance of success.
run like a top,To operate flawlessly and smoothly.
safe as a kitten,In a state of complete safety.
safe as houses,Very secure.
sell like hot cakes,To be sold in large numbers quickly.
shake like a leaf,"To tremble, as with fear, cold, etc.; to shiver."
sharp as a bowling ball,Not at all sharp-witted; very stupid.
sharp as a butter knife,Not very intelligent.
sharp as a tack,Very intelligent.
ships that pass in the night,"Two or more people who encounter one another in a transitory, incidental manner and whose relationship is without lasting significance; two or more people who almost encounter one another, but do not do so."
sick as a cat,Very ill.
sick as a dog,Very ill.
sick as a horse,Very ill.
sick as a parrot,Extremely sick; very ill.
silent as a grave,Extremely quiet
silent as the grave,Saying absolutely nothing (especially about a particular subject).
single as a dollar bill,Very much single; having no romantic involvement with anybody else.
sing like a bird,To have a beautiful singing voice.
sink like a stone,"To sink immediately, with no chance of floating."
skinny as a rail,"Especially of a person, very skinny."
sleep like a baby,"To sleep very well, especially peacefully."
sleep like a log,"To sleep heavily, long and without disturbance."
slick as a whistle,Smooth and skillful; performed with ease and grace.
slick as snot,Very slick.
slippery as an eel,So slippery that it is almost impossible to hold.
slow as a snail,Extremely slow
slow as tar,Very slow.
sly as a fox,"Very sly, very cunning."
smart as a whip,Very intelligent.
smart as paint,Very smart in appearance.
smell like a rose,"To be regarded as appealing, virtuous, or respectable; to be untainted or unharmed."
smell like a tart's handbag,To smell strongly of perfume.
smoke like a chimney,To smoke tobacco frequently.
smooth as a baby's bottom,Extremely smooth.
smooth as butter,Extremely smooth.
smooth as eggs,Very smooth.
smooth as oil,Extremely smooth.
smooth as silk,Extremely smooth (in any sense).
snug as a bug in a rug,Very cosy and comfortable.
sober as a judge,Completely sober.
soft as a baby's bottom,Extremely soft (not rough).
soft as silk,"very soft, soft as a baby's bottom"
solid as a rock,"Extremely thick and heavy, so as to make it impossible to move."
sound as a barrel,"healthy, enjoying good health"
sound as a bell,In excellent condition.
sound as a roach,Perfectly sound.
spend money like water,To spend a lot of money without concern over whether it is spent wisely.
spread like wildfire,To spread or disseminate rapidly or uncontrollably.
squeal like a stuck pig,"To utter loud, high-pitched squeals."
stare like a stuck pig,To be dumbstruck.
steady as a rock,Extremely stable physically.
stick like shit,"To be very tenacious, or be very difficult to get rid of."
stick out like a sore thumb,To be very noticeably (and undesirably or humorously) different; to be prominently out of place; to be particularly obtrusive or conspicuous (usually unintentionally); to attract unwanted attention or notice.
stick out like dog's balls,"Be very noticeably different, especially in a negative way; to be particularly obtrusive, conspicuous, blatant, or prominent; to attract undue attention or notice."
stiff as a board,Very stiff.
stiff as a poker,Very stiff.
still as a stock,stock still
sting like a bee,to deliver a powerful punch
stink like a mackerel,To reek; to smell terrible.
stink like a polecat,"To have a bad smell, mostly referring to human body odor."
stitched up like a kipper,cheated or exploited; treated unfairly
straight as a die,Completely or totally straight.
straight as an arrow,Very straight; travelling in a very straight trajectory.
straight as a soldier,Perfectly straight (immobile).
strong as a bull,Very strong.
strong as a horse,Very strong.
strong as an ox,Very strong and powerful.
stubborn as a mule,Extremely stubborn
stuffed like a turkey,Very full from overeating.
sure as a gun,Surely; with certainty.
sure as death,Most certainly.
sure as death and taxes,Totally certain.
sure as eggs,surely; doubtlessly
sure as eggs is eggs,Most certainly.
sure as fate,surely; with certainty
sure as shit,sure enough
sure as shooting,Absolutely certain.
sure as sugar,Sure enough.
sure as taxes,Most certainly.
sure as the sun is going to come up tomorrow,Surely; certainly.
sure as the world,sure enough
swear like a trooper,To swear a lot; to utter many swear words.
sweat like a hooker in church,To sweat profusely; to produce a lot of perspiration.
sweat like a pig,To sweat profusely; to produce a lot of perspiration.
sweat like a whore in church,To sweat profusely; to produce a lot of perspiration.
sweet as a nut,Extremely good.
sweet as pie,"Extremely sweet (in the sense of cute, lovely)."
swim like a fish,To be a very strong swimmer.
talk like a book,"To talk pedantically, or using excessively difficult or literary words."
talk like an apothecary,To prattle.
there's nowt so queer as folk,Nothing is as strange as people can be; people can behave very oddly sometimes.
thick as a brick,Very stupid; slow to learn or understand. Kieran Bradley
thick as a plank,Very stupid.
thick as mince,Very stupid
thick as two short planks,Very stupid.
thin as a barber's cat,Very thin.
thick as pig shit,Extremely stupid.
thick as thieves,"Intimate, close-knit, tight."
thin as a rail,"Very thin, unhealthily thin."
thin as a rake,"Incredibly thin, at an unhealthy-looking level of thinness."
thin as a wafer,Extremely thin.
tight as a drum,Completely tight.
tight as a duck's arse,Extremely tight; mean; excessively thrifty.
tight as a tick,"Drunk, inebriated."
timid as a mouse,Very timid.
timid as a rabbit,Very timid.
tough as nails,"Having a hard, strong, and determined mindset."
tough as old boots,Very tough; very strong.
tough as teak,Very tough.
treat like dirt,"To treat someone badly, especially with disrespect or contempt."
ugly as bull-beef,Very ugly.
ugly as sin,Extremely ugly.
useful as a chocolate teapot,Totally useless.
useful as tits on a bull,Totally useless.
voice like a foghorn,"A very loud, unpleasant voice."
warm as life,Very warm.
warm as toast,Very pleasantly warm.
watch like a hawk,To observe (someone or something) closely and keenly.
weak as piss,Very weak (in various senses).
weak as water,Very weak.
wetter than an otter's pocket,"Completely wet, drenched, soaked."
white as a ghost,"Very white, especially of a person's face as a result of fear."
white as a sheet,"Very white or pale, as if suffering from shock."
white as driven snow,extremely white; totally white (of a color).
white as snow,Very white.
wise as an owl,Very wise.
wisht as a winnard,"Sickly, weak."
work like a dog,To work very hard.
work like a horse,To work very hard; to toil.
work like a mule,To work very hard; to toil.
work like a nailer,To work very hard.
a bad penny always turns up,"A person or thing which is unpleasant, dishonorable, or unwanted tends to appear (or reappear), especially at inopportune times."
a bad tree does not yield good apples,Bad parents do not raise good children.
a bad workman always blames his tools,"It is not the tools we use that make us good, but rather how we employ them."
a bird in the hand,Short for a bird in the hand is worth two in the bush.
a bird in the hand is worth two in the bush,A sure thing is preferable to the mere chance at something more.
a buck's a buck,"Every dollar of income counts toward one's financial well-being; money is a strong motivator, even in unpleasant situations."
a burnt child dreads the fire,A person harmed by something becomes more cautious about it.
a camel is a horse designed by a committee,Too many people on one project can spoil it by having conflicting or inexperienced ideas.
a cat in gloves catches no mice,One cannot obtain what one desires by being cautious; one must be aggressive.
a cat may look at a king,"A purported inferior has certain rights or prerogatives, even in the presence of a purported superior."
accidents will happen in the best regulated families,"Accidents will always happen, even where there is an expectation of success."
a change is as good as a rest,Doing something different from one's routine is as refreshing as taking a break from work altogether.
a closed mouth catches no flies,It's best not to talk too much.
a closed mouth doesn't get fed,Someone who does not express their needs or desires is less likely to obtain them.
a closed mouth gathers no feet,One who does not speak can be sure of not saying anything embarrassing.
a contented mind is a perpetual feast,Contentment is more a matter of attitude than circumstances.
a creaking door hangs longest,Someone who is apparently in poor health may well outlive the ostensibly-stronger.
actions have consequences,All individual actions may result in negative repercussions.
a danger foreseen is half avoided,It is necessary to foresee danger as it helps you to avoid it.
a drowning man will clutch at a straw,"A person in desperate need of help will grab hold of some help, even if it is insignificant."
a dumb priest never got a parish,Those who fail to speak up will fail to get what they desire.
a fair booty makes many a thief,People are easily tempted to dishonesty if there is a substantial prize to be gained.
a fault confessed is half redressed,"By confessing to one's own faults, one will begin to make amends."
a fool and his money are soon parted,It is easy to obtain money from foolish people.
a foolish consistency is the hobgoblin of little minds,"Consistency may not be the key to success; changes, even minor ones, must be introduced."
a friend in need is a friend indeed,"If a friend helps one when one is in need, that person is a true friend."
age is just a number,Age is not an important attribute in a person.
a golden key can open any door,Sufficient money can accomplish anything.
a good beginning makes a good ending,Start off on a good note to reap the benefits at the end.
a good conscience is a soft pillow,A clear conscience allows one to sleep peacefully.
a good deed is its own reward,"One should not expect a reward for good deeds, but should perform them merely for the satisfaction of doing so."
a healthy body is a healthy mind,Physical fitness leads to mental acuity.
a hit dog will holler,An offended or defensive response to a statement suggests that the statement applies to the person complaining.
a house divided against itself cannot stand,A group or organization that is weakened by internal dissent will not remain united.
a house is not a home,A home is not merely a building but requires inhabitants and a friendly atmosphere.
a hungry man is an angry man,One who is deprived of a basic need is easily angered.
a journey of a thousand miles begins with a single step,Even the longest and most difficult ventures have a starting point.
a leopard cannot change its spots,One cannot change one's own nature.
a lie can run around the world before the truth can get its boots on,A falsehood may spread widely before it can be counteracted with the truth.
a lie has no legs,One cannot get away with a lie; the truth will always come out.
a little knowledge is a dangerous thing,A small amount of knowledge can mislead individuals into believing that they are more experienced and expert than what is actually the case.
"all animals are equal, but some animals are more equal than others",Used to satirize the hypocrisy of unequal political hierarchies in societies that profess equality for all.
all cats are gray in the dark,Standard spelling of all cats are grey in the dark.
all good things come to an end,Nothing good lasts forever.
all is fish that comes to the net,Anything that happens can be used for one's advantage.
all politics is local,"Ultimately, constituents and voters are concerned most about issues that affect their personal lives and home communities, and they vote accordingly."
all's fair in love and war,Unpleasant behavior is acceptable during love and conflict.
all's well that ends well,A happy ending makes up for everything that has happened before.
all that glitters,Short for all that glitters is not gold.
all the world's a stage,People have roles to play in life just as actors do in the theatre.
all things come to those who wait,A patient person will be satisfied in due time; patience is a virtue.
almost doesn't count,Near success (or near accuracy) is not adequate.
a man is known by the company he keeps,People are similar in character to their friends.
a man's home is his castle,A proverbial expression of personal privacy and security.
a mind is a terrible thing to waste,One should put one's mental faculties to good use.
a miss is as good as a mile,"A failure remains a failure, regardless of how close to success one has actually come."
"a moment on the lips, a lifetime on the hips",Indulgence in food and drink gives a brief period of sensory pleasure but tends to increase one's body weight in the long term.
an apple a day keeps the doctor away,Apples are healthy and stave off illnesses.
an army marches on its stomach,You must eat properly if you want to perform tasks well.
a new broom sweeps clean,New management will often make radical changes.
"a new broom sweeps clean, but an old broom knows the corners","New management imposes radical changes, but those with prior experience have more knowledge."
"an eye for an eye, a tooth for a tooth","compensation for injury caused by a person, in the form of inflicting of an identical injury on that person."
an eye for an eye makes the whole world blind,A policy of revenge will lead to counterretaliations rather than peaceful resolutions.
a nod is as good as a wink,"The hint, suggestion etc. can be understood without further explanation."
an old dog for a hard road,It takes an experienced person to execute a difficult undertaking.
"another day, another dollar","Everything is routine and mundane, and nothing eventful or extraordinary has happened."
another day in paradise,Everything is going well.
an ounce of prevention is better than a pound of cure,It is better to prevent a disease than to have to cure it.
any hole's a goal,Any receptive sex partner (or orifice) is acceptable.
any port in a storm,One should accept any passable option when time is of the essence in an adverse situation.
a picture is worth a thousand words,A visualisation is a better description than a verbal description.
a problem shared is a problem halved,"If a problem is shared with others, its solution becomes easier."
a promise is a promise,One must keep one's promises.
a promise made is a promise kept,A promise that one makes should be or can be considered a promise that one will certainly honor.
a prophet is not without honor save in his own country,A person may be believed or respected by others but not by those closest to them.
a rising tide lifts all boats,A truly good outcome benefits all.
a rolling stone gathers no moss,A person who never settles in one place will never be successful.
"art is long, life is short",Art is more enduring than an individual's lifetime.
"as a dog returns to his vomit, so a fool repeats his folly",Foolish people repeatedly do foolish things.
"ask a silly question, get a silly answer","If one asks a question that is stupid or to which the answer is obvious, one should not be surprised or displeased to receive a silly or bizarre response."
a smooth sea never made a skilled sailor,"Challenging experiences are the most educational and thus, ultimately, the most beneficial."
a sorrow shared is a sorrow halved,Grief can be alleviated by discussing it with someone.
a spoonful of sugar helps the medicine go down,An otherwise unpleasant situation can be pleasant when a pleasant aspect is deliberately introduced.
"as the twig is bent, so is the tree inclined",A person's formative experiences in youth influence their character during adulthood.
a stitch in time saves nine,A little effort expended sooner to fix a small problem prevents it from becoming a larger problem requiring more effort to fix later.
a stopped clock is right twice a day,"A normally unreliable person or instrument can occasionally provide correct information, even if only by accident."
a straw shows how the wind blows,A general situation can be inferred from minor indications.
"as you make your bed, so you must lie in it",One will carry negative consequences of not having prepared properly.
"as you sow, so shall you reap",The consequences of one's actions to oneself are in proportion to one's good or bad intentions towards others.
a trouble shared is a trouble halved,Talking about one's difficulties can alleviate one's worry and stress.
attack is the best form of defence,"In a battle or dispute, attacking the opposition first is better than waiting for them to attack."
attitude reflects leadership,Lower subordinates in an organization practice the behavior that is tolerated and encouraged by their superiors.
a watched pot never boils,A process appears to proceed more slowly if one waits for it rather than engaging in other activities.
a wild goose never laid a tame egg,Most things are inherited and predetermined.
a woman's work is never done,"Housework, which is generally considered women's work, is never finished."
bad facts make bad law,Unusual circumstances can lead lawmakers or judges to set precedent that applies poorly to most situations.
bad money drives out good,Debased coinage (with low levels of precious metals) replaces purer coinage (with higher levels of precious metals).
bad news travels fast,Bad news circulates quickly because people often circulate it everywhere.
bad things come in threes,"If one unfortunate event has already occurred, a second and third are likely to occur; if two, a third should be expected."
barking dogs seldom bite,People who make threats rarely carry them out.
"beauty fades, dumb is forever","One's attractiveness will diminish over time, but one's stupidity is perpetual."
beauty is in the eye of the beholder,Different people have different views on what is beautiful; beauty is subjective.
beauty is only skin deep,A person's character matters more than their appearance.
beauty won't make the pot boil,"Being physically attractive may have its benefits, but it is not enough to make a living."
beggars can't be choosers,Something is better than nothing: those who can't provide for themselves should accept whatever help is available.
behind every successful man there stands a woman,A man's achievements are made possible by the support and work of their wife or female partner.
believing is seeing,One needs to believe something in order to know or understand it.
better an egg today than a hen tomorrow,It is better to have a sure thing now than a possibility of more later.
better dead than red,It is preferable to be deceased than to be a Communist or ruled by Communists.
better safe than sorry,It is preferable to be cautious in one's choices and actions than to act recklessly and suffer afterwards.
better the devil you know than the devil you don't know,Something bad and familiar is better than something bad and unknown.
better to light a single candle than to curse the darkness,"Even in the face of hopelessness and discontent, it is more worthwhile to do some good, however small, in response, than to complain about the situation."
"bet the jockey, not the horse","One should invest based on the management team behind a venture, rather than on the product or service being sold."
big things come in small packages,Things should not be underestimated because of their small size.
"bi now, gay later",A slogan suggesting that bisexual people tend to become exclusively homosexual later in life.
bird in the hand,Short for a bird in the hand is worth two in the bush.
birds of a feather flock together,"People of similar character, background or taste tend to congregate or associate with one another; it is easier to establish friendships with people that one has a lot in common with."
bis dat qui cito dat,"Something (e.g., payment, assistance, etc.) given promptly is much more valuable than if given after considerable delay."
blood is thicker than water,Family relations and loyalties are stronger than relationships with people who are not family members.
boys will be boys,"It is hard, often fruitless, to attempt to curb the natural playfulness and tendency to mischief of most growing boys."
brevity is the soul of wit,"Conciseness of expression is an essential characteristic of astute, perceptive, or witty remarks."
bros before hoes,A man should prioritize his male friends over women.
business before pleasure,Discharging one's obligations must take precedence over devoting time to pursuits meant solely for one's own gratification.
"buy cheap, buy twice",Buying a cheap but inferior product is a false economy since it will need replacement.
"can't live with them, can't live without them","There is a hopeless, ongoing conflict between annoyance with someone or something and need for that same person or thing."
carpe diem,"Enjoy the present, make the most of today,  seize the day."
"cats rule, dogs drool",A cat will always be superior or preferable to a dog.
caveat lector,Reader beware.
charity begins at home,One should help the people closest to oneself before thinking of helping others.
cheats never prosper,One does not profit by cheating.
chicks before dicks,A woman should prioritize her female friends over her boyfriend or husband.
children should be seen and not heard,"Children should behave well and be quiet, especially in the presence of adults."
claret would be port if it could,Everybody would change their circumstances if it were possible.
"claw me, claw thee",you scratch my back and I'll scratch yours
cleanliness is next to godliness,It is important and morally sound to keep one's body and home clean; those who practice purity and wholeness are close to God.
clogs to clogs in three generations,Wealth earned in one generation seldom lasts through the third (grandchild's) generation.
close only counts in horseshoes,Coming close to achieving a goal is not good enough.
"cobbler, keep to your last",Do not criticise matters outside your field of expertise; mind your own business.
"cold hands, warm heart",Having cold hands is an indication of warmheartedness; used as a rejoinder if one finds that another's hands are cold.
common sense is neither common nor sensical,"Many assumptions that people make through intuition, popular culture, or 'common sense' turn out to be incorrect."
comparison is the thief of joy,Comparing one's own situation with that of others will lead to unhappiness or bitterness.
cooler heads will prevail,People who are calm and focused are the most likely to succeed or to have the greatest influence on events.
crime doesn't pay,If you commit a crime you will most likely be punished for it.
curiosity killed the cat,One should not be curious about things that can be dangerous.
dance with the one that brought you,"To be considerate and loyal to the person who has been supportive, attentive, or helpful."
dead men tell no tales,"A dead person can no longer reveal information, especially information which others wish to keep secret."
death is the great leveller,Death balances all.
desperate times call for desperate measures,"In adverse circumstances, actions that might have been rejected under other circumstances may become the best choice."
diamonds are a girl's best friend,"While love is a luxury, material wealth (particularly jewellery) is more valuable to a girl."
different strokes for different folks,Different people like different things; there's no accounting for taste.
discretion is the better part of valour,It is often wise to refrain from seemingly brave speech or action.
