idiom,definition
the fucking you get isn't worth the fucking you get,The sexual satisfactions that one receives from a spouse or romantic partner are not sufficient to compensate for the significant periods of bad faith and unpleasant treatment which such relationships routinely involve.
the game is not worth the candle,The process or result is not worth the effort.
the good die young,"Well-regarded people who are morally upright, kind, and beneficent tend to die at a younger age than do most people."
the grass is always greener on the other side,The circumstances of others seem more desirable than one's own but in reality often are not.
the grey mare is the better horse,"The wife, not the husband, is in charge of the household."
the hand that rocks the cradle rules the world,"Women, particularly mothers, have a decisive influence on the future direction of society because they raise and nurture the next generation."
the heart wants what it wants,Who one falls in love with is not a rational or deliberate decision.
the highest branch is not the safest roost,A coveted position of power does not guarantee safety to the holder.
the house always wins,"In a casino, all gambling is designed so that the house (i.e. the casino owners) will always net a profit, regardless of the successes of individual patrons."
the jug goes to the well until it breaks,"Even though something can be used well at the moment, it will eventually break down as everything does."
the laborer is worthy of his hire,People deserve to be rewarded for their efforts.
the law is an arse,Misconstruction of the law is an ass
the law is an ass,"The law, as created by legislators or as administered by the justice system, cannot be relied upon to be sensible or fair."
the longest pole knocks the persimmon,Whoever has the most advantages has the best chance of success.
the map is not the territory,"Our models of the world, and our sensations of the world, are not the true world."
the mill cannot grind with water that is past,Do not cry over spilt milk; what has already happened cannot be changed or repaired.
the mills of the gods grind slowly,"Justice may arrive slowly, but it cannot be avoided."
the more the merrier,Something is more fun with more people.
"the more things change, the more they stay the same",Turbulent changes do not affect reality on a deeper level other than to cement the status quo.
"the more you know, the higher you go",Expertise leads to career promotion.
the nail that sticks out gets hammered down,Those who are too different or conspicuous get criticized or sanctioned by others.
"the odds are good, but the goods are odd","There are plenty of potential romantic/sexual partners available, but many of them are strange or eccentric people."
the pen is mightier than the sword,More influence and power can be usurped by writing than by fighting.
the pitcher goes so often to the well that it is broken at last,"When something is used enough times, it will eventually break down."
the poor we will always have with us,Poverty for some is inevitable.
the proof of the pudding is in the eating,One can only claim that something is a success after it has been tried out or used.
there are bad apples in every orchard,Every community and demographic has troublesome members.
there are more horses' asses than horses,"There are plenty of obnoxious people (in the world, or in a specified place or situation). Apparently it can also refer to political situations."
there are no atheists in foxholes,"In times of extreme stress or fear, even those who do not believe in a benevolent higher power will hope that one exists."
there are none so blind as those who will not see,Understanding cannot be forced on someone who chooses to be ignorant.
there are plenty of fish in the sea,There are many more potential opportunities available.
there are two sides to every question,One should not make a judgement until one hears the other side.
there is an exception to every rule,Usually said in a situation when the rule is incorrect and unusable.
there is a time and place for everything,Certain things are appropriate at a certain time and place.
there is no honor among thieves,Most thieves lack a sense of honor and are not to be trusted.
"there is no such thing as bad weather, only bad clothing",Any type of weather can be endured if adequate clothing is worn.
there is nothing more permanent than a temporary solution,Short-term provisions tend to gain traction and become difficult to remove.
there is nothing new under the sun,There is nothing truly novel in existence; every new idea has some sort of precedent or echo from the past.
there is reason in the roasting of eggs,There is a reason behind even the most odd and seemingly unnecessary actions.
there is safety in numbers,"There is a purported decrease in the likelihood of being the victim of an attack, accident, or other unfortunate event, as a result of being in a team or group."
there is strength in numbers,There is more strength in groups than individuals.
there may be snow on the rooftop but there is fire in the furnace,"Even a person in his or her senior years, with gray hair, can still have ambition and energy, especially sexual energy."
there's a first time for everything,Something could happen even if it has not happened before.
there's a lid for every pot,Somewhere in the world there is a compatible romantic partner for everybody.
there's always a bigger fish,"No matter how large or intimidating a person or thing is, there is likely to be an even larger or more intimidating person or thing somewhere."
there's a rotten apple in every barrel,There is a bad person in any group.
there's a sucker born every minute,"&nbsp;There is a great number of fools in the world who can be easily swindled, and they will always exist."
there's many a good tune played on an old fiddle,Just because something or someone is old does not mean that it or they are no longer useful or worthwhile.
there's many a slip twixt cup and lip,"In any situation, however well planned, something can always go wrong."
there's more than one way to skin a cat,A problem generally has more than one solution; there is more than one way to achieve a goal.
there's no accounting for taste,"In subjective matters of taste, people have wildly different opinions; disagreements about matters of taste cannot be objectively resolved."
there's no business like show business,The domain of the entertainment industry is more dazzling and exciting than any other business.
there's no fool like an old fool,"If a person does not develop wisdom with age, then their foolishness is all the more obvious and shameful."
there's no place like home,One feels most comfortable at home.
there's no point crying over spilt milk,You shouldn't be upset over something that can't be undone.
there's no time like the present,Now is an appropriate time to take a particular action.
the revolution will not be televised,"A societal revolution will happen genuinely and in real life, and will not be caught on film."
the road to hell is paved with good intentions,Well-intended acts can potentially lead to disasters.
the shoemaker's children go barefoot,One often neglects those closest to oneself.
the sky is the limit,Nothing is impossible or out of reach.
the spirit is willing but the flesh is weak,"As much as one wishes to achieve something, the frailties of the human body often make it impossible. Sometimes extended to jocular or organizational referents."
the squeaky wheel gets the grease,The person who complains or speaks up most loudly receives the redress or attention which they seek.
the strong do what they can and the weak suffer what they must,"The weak cannot resist the decisions of the strong; power, not morality, decides the outcome of any dispute."
the tongue wounds more than a lance,Insults and offensive speech hurt more than physical injuries.
the way to a man's heart is through his stomach,Cooking food for a man is a good way to win his affections.
the wheel turns,Time moves forward; circumstances change; life continues.
the wolf may lose his teeth but never his nature,"One cannot change one's nature, no matter how much time passes."
the world is one's lobster,"Intentional misrendering of the proverb ""the world is one's oyster""."
the world is someone's oyster,All opportunities are open to someone; the world is theirs.
they hate us 'cause they ain't us,The reason that certain people are disliked is that others are jealous of them.
they'll do it every time,"One must be vigilant and cognizant of challenging and hazardous surroundings or situations, or the usual events will occur."
third time's a charm,One is sure to succeed at a task or event on the third try.
this too shall pass,"Nothing, good or bad, lasts forever; all circumstances are temporary."
"those that have, get",People who already have wealth and status are the most likely to acquire additional wealth and status (usually with the implication that the distribution of life's benefits and opportunities is unfair).
"those who can't do, teach",It is easier to get a job teaching how to do something than to get a job actually doing that thing.
those who say it cannot be done should not interrupt those doing it,People who dispute that a task is possible should not impede those people who attempt to do it.
"those who will not when they may, when they will they shall have nay",One should take immediate advantage of an opportunity that may not be available later.
three strikes and you're out,"Three mistakes, rule breaches etc. will result in termination, disqualification or similar."
"throw dirt enough, and some will stick","If enough allegations are made about someone or something, then even if they are all untrue, people's opinion of the person or thing will be diminished."
throw enough mud at the wall and some of it will stick,"Try the same thing (or similar things) often enough, and, even if the general standard is poor, sometimes one will be successful."
"throw enough mud at the wall, some of it will stick","To attempt the same strategy or technique (or similar ones) often enough, and, even if the general standard is poor, sometimes one will be successful."
time and tide,time and tide wait for no man
time and tide wait for no man,Opportunities will not wait; action should be undertaken without delay.
time flies when you're having fun,Time seems to pass more quickly when one is enjoying oneself.
time heals,Ellipsis of time heals all wounds.
time heals all wounds,Negative feelings eventually fade away.
time is money,"Money is wasted (in lost wages, missed opportunities, etc.) when a person's time is not used productively; time is valuable and should not be wasted."
time spent laughing is time spent with the gods,Laughter is bliss.
timing is everything,Consideration of other events can greatly influence some desired outcome (such as whether a joke is well received).
today is a good day to die,"An expression of willingness, even eagerness, to give one's life for a cause."
to each his own,Every person is entitled to his or her personal preferences and tastes.
to err is human,Everyone makes mistakes.
"to err is human; to forgive, divine",Extended form of to err is human
tomorrow is another day,Tomorrow will bring new opportunities and a fresh start for one's endeavors.
tomorrow never comes,A goal or action which is postponed until a future day is often never accomplished; do not procrastinate.
too many cooks spoils the broth,Uncommon form of too many cooks spoil the broth.
too many cooks spoil the broth,"If too many people participate in a task, especially in a leading role, the task will not be done very well."
too much bed makes a dull head,Too much inactivity makes one less mentally acute.
too much pudding will choke a dog,One can have too much of a good thing.
too much water drowned the miller,One may have too much of a good thing.
to the victor go the spoils,"The winner of a conflict gains additional benefits, beyond the subject of the conflict."
to thine own self be true,Be yourself; be true to yourself; do not engage in self-deception.
"treat them mean, keep them keen",A woman will be more interested in a man if he is not kind to her.
"trust everybody, but cut the cards","Have general faith in the good intentions of others, but never neglect to take appropriate precautions against being deceived or cheated."
truth is stranger than fiction,Sometimes actual events are stranger than imagined ones.
truth will out,A mystery will always be solved; truth will eventually and inevitably be discovered.
turnabout is fair play,It is allowable to retaliate against an enemy's dirty tricks by using the same ones against them.
two can play that game,The tactics or strategies of an adversary can also be used against them.
two heads are better than one,Some tasks may be accomplished more easily by two (or more) people working together than by one working alone.
"two's company, three's a crowd",One companion is preferable to two.
two wrongs don't make a right,A wrongful action is not a morally appropriate way to correct or cancel a previous wrongful action.
two wrongs make a right,A logical informal fallacy whereby a wrongful action is justified by the commission of another.
underpromise and overdeliver,Improve business interactions and relationships with customers by setting modest expectations and then exceeding those expectations by delivering more than what was initially promised or expected.
uneasy lies the head that wears a crown,A person of high rank or status has more problems than those of lower rank.
"united we stand, divided we fall",People are more successful as a group than as individuals.
unity is strength,Being united makes us become stronger.
use it or lose it,Skills or knowledge that are seldom applied are likely to be lost with time.
variety is the spice of life,Variety is what makes life interesting.
walls have ears,"There is always a risk of being overheard, so one should be careful about what one says."
wanton kittens make sober cats,People who are unruly and reckless in youth may nevertheless turn out to be responsible adults.
"waste not, want not",If one is not wasteful then one will not be in need.
water seeks its own level,"People of similar interests, abilities, morals, etc. tend to end up in each other's company."
we are where we are,"acknowledging the shortcomings of the present situation, while focusing on dealing with it rather than either dwelling on the causes or regretting what might have been"
well begun is half done,Much depends on the beginning of an endeavor.
what doesn't kill you makes you stronger,Hardship builds moral character.
what goes around comes around,"A person's actions, whether good or bad, will often have consequences for that person."
what goes up must come down,"All trends will end; a rise (in the stock market, in a person's political or social influence, etc.) will be followed by a fall."
what has been seen cannot be unseen,"Repulsive, disturbing, or horrific sights can never be erased from memory once they have been seen."
what's bred in the bone will come out in the flesh,One's behavior or characteristics are determined by one's heredity.
what's done is done,"Events that have already taken place cannot be changed and actions that have already been committed cannot be undone, so it is best not to dwell on them."
what's good for the goose is good for the gander,"Literally, what is good for a female goose is equally good for a male goose (gander); or, what is good for a woman should be equally as good for a man."
what's sauce for the goose is sauce for the gander,"If something is acceptable for one person, it is acceptable for another (often of the opposite gender)."
"what the eye doesn't see, the heart doesn't grieve over",Problems and losses that do not reach the attention cause no worries and no grief.
what you lose on the swings you gain on the roundabouts,"There are both gains and losses in life; you win some, you lose some."
what you see is what you get,The image corresponds to the reality.
"when in doubt, do nowt","When faced with a difficult decision, it is better not to take unnecessary risks."
"when it rains, it pours","Unfortunate events occur in streaks or clusters, often in short periods of time."
"when life gives you lemons, make lemonade",You should always make the best out of difficult situations.
"when one door closes, another opens","When one opportunity is lost, another opportunity soon becomes available."
when the cat's away,"Ellipsis of when the cat's away, the mice will play."
when the cat's away the mice will play,"In the absence of a controlling entity, subordinates will take advantage of circumstances."
"when the going gets tough, the tough get going","In difficult times, it is the strong-willed who take action."
"when the looting starts, the shooting starts",Lethal force is justified against rioters and looters.
"when you hear hoofbeats, think of horses, not zebras","When diagnosing a patient's symptoms, common ailments should be considered as more probable than rare ones."
"when you mess with the bull, you get the horns","If you provoke someone dangerous, you can expect an aggressive reaction."
"when you're up to your neck in alligators, it's hard to remember that your initial objective was to drain the swamp","It is easy to lose sight of one's initial objective, becoming caught up in subtasks or in tasks only tangentially related to the original goal."
where there is a will,Ellipsis of where there is a will there is a way.
where there is a will there is a way,"If someone wants or wills something strongly enough, a way can be found to make it happen."
where there's muck there's brass,"There is money to be made even in unpleasant, dirty jobs."
where there's no sense there's no feeling,A living thing of little or no intelligence does not feel pain or other negative sensations.
"where there's smoke, there's fire","If there is a hint of something occurring it could indeed be true, but such rumors should be taken with a grain of salt."
"wherever you go, there you are",One cannot run from one's problems indefinitely.
where you stand depends on where you sit,One's position in an organization dictates one's stance on an issue.
"while the grass grows, the steed starves","In the process of trying to achieve something, one's aspirations may be realized too late."
who keeps company with the wolf will learn to howl,A person tends to acquire the characteristics of those with whom they associate.
who pays the piper calls the tune,The person who pays for something gets to say how it should be done.
why buy a book when you can join a library,Being available for sexual relationships with various people is preferable to committing oneself to a single partner.
why buy the cow when you can get the milk for free,"Do not expect somebody to make a costly commitment if it will give them nothing they do not already have; used especially as a warning against having sexual intercourse before marriage (or conversely, as encouragement against getting married)."
why keep a dog and bark yourself,One should not do something that one has hired someone else to do.
words cut deep,"Insults and offensive speech hurt more than physical injuries, and are not easily forgotten."
"work smarter, not harder",Problems are solved more effectively by intelligence rather than by hard hustle.
worse things happen at sea,Things are not as bad as they seem.
wrap it before you tap it,It is wise to wear a condom before sexual intercourse.
y'all means all,Bigotry and intolerance are unacceptable; no one should be discriminated against.
yesterday is gone,It is impossible to change or to relive what has already happened.
you are what you eat,"Personal health and wellbeing is determined by one's eating habits, in both positive and negative ways."
"you buy cheap, you get cheap",Inexpensive goods and services tend to be inferior to more expensive ones.
you can catch more flies with honey than with vinegar,It is easier to persuade others with polite requests and a positive attitude rather than with rude demands and negativity.
"you can lead a horse to water, but you can't make it drink","You can show someone how to do something, but you can't make them do it."
you cannot please everyone,It is not possible to act in a manner that will please everyone
you cannot put the same shoe on every foot,A method or technique that works in one situation does not necessarily work in all situations.
"you can take the monkey out of the jungle, but you can't take the jungle out of the monkey","Black people, in the view of racists, behave badly regardless of their whereabouts or socialization."
you can't be half pregnant,Said of an either-or situation; there are only two available choices.
you can't catch old birds with chaff,The wisest and the most experienced cannot be easily deceived.
you can't fix stupid,It is often fruitless to help people who are stupid and do stupid things.
you can't get a quart into a pint pot,You cannot fit a large object or amount in something smaller.
you can't go home again,Past times which are fondly remembered are irrecoverably in the past and cannot be relived.
you can't judge a book by its cover,It is not possible to make reliable judgments about things or people by considering external appearances alone.
you can't keep a good man down,"A person who has talent, resolve, or moral strength will eventually succeed despite having been overlooked, injured, or defeated."
you can't make an omelette without breaking eggs,"In order to achieve something, it is inevitable and necessary that some mistakes are made or some sacrifices must occur."
you can't make a silk purse of a sow's ear,"It is not possible to produce something refined, admirable, or valuable from something which is unrefined, unpleasant, or of little or no value."
you can't outrun your fork,Exercise is not enough to counteract an unhealthy diet.
you can't polish a turd,Something inherently unfavourable or unpleasant cannot be improved.
you can't pour from an empty cup,"In order to be able to provide other people with emotional support, one must take care of one's own mental health."
you can't put an old head on young shoulders,Young people inevitably lack the experience and wisdom which come with age.
you can't put the toothpaste back in the tube,"Once something is said or done, it cannot be unsaid or undone."
you can't run with the hare and hunt with the hounds,You can't have it both ways.
you can't step in the same river twice,"It is not possible to repeat past experiences, as time changes all things."
you can't take it with you,It is not possible to take one's material wealth or possessions to whatever world may await one after death.
you can't teach an old dog new tricks,"It is impossible to change people's habits, traits, or mindset."
you can't turn a hoe into a housewife,A sexually promiscuous woman is not a suitable candidate for a committed housewife.
you can't unring a bell,Some things cannot be undone.
you can't win them all,It is impossible to always succeed; failure or disappointment is inevitable from time to time.
you don't dip your pen in company ink,One should avoid romantic or sexual relationships in the workplace.
you don't get something for nothing,One cannot expect to receive some benefit if one does not pay for it in some way or does not face a counterbalancing hazard or harm.
you don't look at the mantelpiece when you're poking the fire,A woman's facial attractiveness is irrelevant when considering her as a sexual partner.
you don't need a weatherman to know which way the wind blows,One does not require an expert to tell one what one already knows.
you get more with a kind word and a gun than you do with a kind word alone,It is advantageous not to rely solely on being nice to others.
you get what you pay for,"In commercial transactions, the quality of goods and services increases as the prices increase, i.e., the more one pays, the better the merchandise."
you have to be good to be lucky,People who succeed do so through skill and preparation rather than mere chance.
you make the bed you lie in,A person's circumstances are normally the result of their own actions.
you miss 100% of the shots you don't take,"To make no attempt to do something guarantees failure, so you should always try."
you must spoil before you spin,One cannot expect success at the first attempt; practice makes perfect.
you never know what you've got till it's gone,People tend to take things for granted while they are available.
you never miss the water till the well runs dry,People tend to take things for granted that are easily available.
you only get what you give,There is a positive correlation between the effort one puts in and the benefits one receives.
you only go around once,"A person has only one lifetime, and should therefore take every opportunity to enjoy a wide variety of experiences in order to maximize their achievements and satisfaction."
you pays your money and you takes your chances,There is no guarantee that you will get the result you want.
you pays your money and you takes your choice,Each person can make his or her own decisions.
you're never too old to learn,"It is possible to learn new things, at any age; one should follow one's desires and dreams."
you're only as good as your last shift,A person's perceived skill or competence is determined by their most recent success or failure.
"your face, your fate",One's fate and how one is treated in life depends on one's looks.
your network is your net worth,Possessing the right or certain professional connections will ensure financial success in one's career.
your vibe attracts your tribe,People are attracted to you based on your appearance and behavior.
you snooze you lose,"If one is not alert and attentive, one will not be successful."
