idiom,definition
absence makes the heart grow fonder,One feels more love or affection for those one loves when parted from them.
a chain is only as strong as its weakest link,An organization is only as strong or powerful as its weakest person; a group of associates is only as strong as its laziest member.
actions speak louder than words,It is more effective to act directly than to speak of action.
all cats are grey in the dark,Sex is enjoyable regardless of the physical attractiveness or social station of one's partner.
all that glitters is not gold,Things that appear valuable or worthwhile might not actually be so; things that appear nice might not be as good as they appear.
any press is good press,"Being mentioned in the media, even in the context of a scandal or controversy, is beneficial to the subject because it brings publicity."
a penny saved is a penny earned,"A maxim for thrift stating that money not spent may be spent later, or may earn interest in the meantime."
appearances are deceptive,It is not possible to judge a person's character from their outward appearance.
a revolution is not a dinner party,"In order to achieve something, courtesy, long-held norms, and other such formalities must be dropped."
better late than never,"It is better to do something late, than to never do it at all."
clothes don't make the man,You cannot accurately judge a person solely by appearances.
clothes maketh the man,A person's appearances count for a lot.
"early to bed, early to rise, makes a man healthy, wealthy and wise",A person who goes to bed early and wakes up early will lead a more successful life.
give a man a fish and you feed him for a day; teach a man to fish and you feed him for a lifetime,It is more worthwhile to teach someone to do something (for themselves) than to do it for them (on an ongoing basis).
heaven helps those who help themselves,A maxim encouraging people to attempt to solve their own problems.
hindsight is 20/20,"In hindsight things are obvious that were not obvious from the outset; one is able to evaluate past choices more clearly than at the time of the choice."
"if it ain't broke, don't fix it","It is wise to leave something alone and to avoid attempting to correct, fix, or improve what is already sufficient (often with an implication that the attempted improvement is risky and might backfire)."
"if you lie down with dogs, you get up with fleas",Spending time with undesirable individuals will cause one to acquire their undesirable traits.
ignorance is bliss,A lack of knowledge results in happiness; it is more comfortable to not know certain things.
"it's not the size of the ship, it's the motion of the ocean","In sexual activity, the size of the penis is less important than the way it is moved."
leave well enough alone,"To leave something alone; to avoid trying to correct, fix, or improve what is already adequate."
"live by the sword, die by the sword",One who uses violence can expect a violent response; it is better to try to use peaceful means wherever possible.
measure twice and cut once,"One should double-check one's measurements for accuracy before cutting a piece of wood; otherwise it may be necessary to cut again, wasting time and material."
never change a running system,Do not change something while it is working (because there is a risk of breaking it).
"one for all, all for one","Each individual should act for the benefit of the group, and the group should act for the benefit of each individual."
size matters,"Used to assert the opinion that sexual partners prefer men with larger penises, or that penis size has an effect on the quality of an act of intercourse."
twenty-twenty hindsight,Perfect understanding of events only after they have happened.
age like a fine wine,To age well; to look or become better as one becomes older.
age like milk,"To age very badly; to look bad in hindsight, or after time has passed."
all over someone like a rash,"Giving someone an excessive amount of attention, especially romantic or sexual attention."
all over the place like a mad woman's custard,Moving about randomly.
a nod's as good as a wink to a blind bat,The idea/proposed action is inconsequential to the current situation.
as all get-out,Extremely; to a superlative degree; very much.
as all hell,To a great extent or degree; very.
as anything,To a great degree or extent; very.
as balls,To a great extent or degree; very.
as fast as one's legs could carry one,At top speed (running on foot); as fast as possible.
as fuck,"To a great extent or degree; very, extremely, incredibly."
as good as new,"In a very good condition or state, especially after being damaged or used much."
as heck,Euphemistic form of as hell.
as hell,To a great extent or degree; very.
as large as life,Actually present.
as much use as a chocolate fireguard,Useless; pointless.
as much use as a chocolate teapot,Thoroughly useless.
as nervous as a witch,Very nervous or restless.
as one man,In a unified manner.
as shit,To a great extent or degree; very
as the day is long,Unceasingly; very; thoroughly; to a very high degree.
as the next girl,To a reasonable degree; as much as a typical woman.
as the next guy,To a reasonable degree; as much as a typical person or man.
avoid like the plague,"To evade or shun, if at all possible."
a woman without a man is like a fish without a bicycle,A woman is capable of living a complete and independent life without a man.
bald as a billiard ball,Completely bald; having no hair at all.
bald as a bladder of lard,Completely bald; having no hair at all.
bald as a coot,Totally bald; without any hair on one's head.
bent as a nine-bob note,Extremely dishonest or criminally-minded.
better than sex,Superlative; wonderful.
big as a barn,Very big.
big as a house,Very large.
big as bull-beef,Very big.
black as a dog's guts,Utterly black; pitch-black.
black as coal,Completely black.
black as night,Utterly black; pitch-black.
black as tar,Completely black.
black as the ace of spades,Utterly black; pitch-black.
black as thunder,Very black .
black as your hat,Thoroughly black in color.
bleed like a stuck pig,to bleed profusely
blind as a bat,"Nearly totally blind, having a very poor sense of vision"
bold as brass,Very bold; very forward or impudent.
boring as beans,Very boring; devoid of interest.
brave as a lion,Very brave; courageous
breed like rabbits,"To breed very rapidly, to have many children"
bright as a button,Very intelligent.
brown as a berry,Very brown.
built like a brick shithouse,"Having a muscular body, particularly with well-developed muscles of the chest, arms and abdominals."
built like a tank,"Broad-shouldered and of solid, muscular build."
busy as a beaver,Very busy.
busy as a bee,Very active; working constantly.
busy as a dyke in a hardware store,Extremely busy.
busy as a nailer,working constantly.
busy as a one-armed paper hanger,Extremely busy.
calm as a millpond,"Very calm, not choppy."
change like seasons,"To change quickly, inevitably, and without a rationale."
charge like a wounded bull,To charge exorbitant prices.
cheap as chips,"Very cheap, not costing much."
cheap like borscht,Very inexpensive.
chirpy as a cricket,Very chirpy; full of energy; very energetic.
clean as a bean,Very clean.
clean as a hound's tooth,Very clean; very innocent.
clean as a new penny,Extremely clean.
clean as a new pin,Very clean.
clean as a whistle,Very clean
clear as a bell,Totally clear; distinct and unmistakeable.
clear as a mirror,Totally clear; visibly distinct.
clear as crystal,Entirely transparent.
clear as day,Quite clear.
clear as mud,Unclear; difficult or impossible to understand or interpret.
close as wax,"miserly, tight, or secretive"
cold as a mackerel,"Very cold (in temperature, emotionally, etc.)."
cold as a wagon tire,Dead.
cold as a well-digger's arse,Very cold.
cold as a witch's kiss,Very cold.
cold as a witch's tit,Very cold.
cold as balls,Very cold.
cold as charity,"Very cold, whether in temperature or in demeanour."
cold as death,Very cold.
cold as ice,Very cold.
comfortable as an old shoe,Comfortably familiar.
common as bums,Very common or mundane (in various senses).
common as dirt,Extremely common.
common as muck,Very common (in various senses).
common as pig tracks,Very common or frequently encountered; not at all rare.
conceited as a barber's cat,Very conceited.
cool as a cucumber,Calm and composed even in difficult or frustrating situations; self-possessed.
cracked as an egg,Utterly crazy or insane.
crazy as a bedbug,Utterly mad; insane.
crazy as a cootie,Completely crazy; insane.
crazy as a cootie bug,Completely crazy; insane.
crazy as a shithouse rat,Thoroughly crazy.
crazy as a soup sandwich,Utterly senseless or insane.
crazy like a fox,"Behaving in a foolish, frivolous, or uncomprehending manner as a ruse for concealing clever deeds or deeper intentions."
crooked as a barrel of fish hooks,Very unscrupulous and deceptive.
crooked as a barrel of snakes,Very untrustworthy.
crooked as a dog's hind leg,very unscrupulous and deceptive
cross as two sticks,Particularly ill-natured and disagreeable.
cry like a baby,To bawl unabashedly and pitifully.
cry like a little girl,To bawl unabashedly and pitifully.
crystal clear,Completely clear (in various senses).
cute as a bug in a rug,Very cute.
cute as a bug's ear,Very cute; adorable.
cute as a button,Very cute.
cute as a pin,Very cute.
cute as a speckled pup,Very cute; adorable.
cut like a knife,"To sting severely, to cause a sensation of stinging, especially said of cold weather."
daft as a brush,Tending to do or say silly things.
dandy as candy,Perfectly fine or good.
dark as the inside of a cow,Extremely dark; pitch-black.
dead as a dodo,Undoubtedly and unquestionably dead.
dead as a doorknob,"Entirely, unquestionably or certainly dead."
dead as a doornail,Unquestionably dead. Used for both inanimate objects and once living beings.
dead as a herring,Utterly dead.
dead as a kipper,Utterly dead.
dead as a mackerel,Utterly dead.
dead as ditch-water,Unquestionably dead.
deader than disco,Unquestionably dead.
deaf as a doorknob,Stone deaf. (unable to hear at all)
deaf as a doornail,Completely deaf.
deaf as a doorpost,Stone deaf. (unable to hear at all)
deaf as a post,Stone deaf. (unable to hear at all)
demure as a whore at a christening,Utterly demure.
done up like a dog's dinner,Dressed in an  ostentatious or overly formal manner.
done up like a kipper,cheated or exploited; treated unfairly
drink like a fish,To drink (especially alcohol) heavily and in excess.
drink something like lemonade,To drink something (especially an alcoholic drink) easily and in large quantities.
drop like a bad habit,To cease contact or a relationship with someone as quickly as possible.
drop like a hot potato,To get rid of or stop doing as quickly as possible.
drop like flies,"To die en masse, one after the other."
drunk as a boiled owl,Thoroughly drunk; inebriated.
drunk as a cunt,Extremely drunk.
drunk as a fiddler,Thoroughly drunk.
drunk as a fiddler's bitch,Thoroughly drunk.
drunk as a lord,Completely drunk.
drunk as an owl,Thoroughly drunk.
drunk as a piper,Thoroughly drunk.
drunk as a skunk,Highly inebriated.
drunk as a sow,Thoroughly drunk.
drunk as a wheelbarrow,Thoroughly drunk.
dry as a bone,completely dry; totally dry
dry as a dead dingo's donger,"Very dry, extremely dry."
dry as a nun's nasty,Very dry.
dry as dust,Very dull or boring.
dull as dishwater,Boring; ordinary; exceedingly dull.
dumb as a bag of hammers,Remarkably stupid.
dumb as a box of rocks,Very stupid.
dumb as a doorknob,Very stupid.
dumb as a doornail,Irrefutably or unquestionably dumb.
dumb as a fish,Utterly mute; never speaking.
dumb as an ox,Stupid.
dumb as a post,Utterly mute; lacking the ability to speak.
dumb as a rock,Very stupid; dumb as a post.
dumb as dirt,Extremely stupid.
dumb as nails,Very dumb (stupid).
dumb like a fox,Very stupid or foolish.
easy as 123,Extremely easy
easy as falling off a log,Very easy.
easy as pie,Very easy.
eat like a bird,To eat in small amounts rather than in a single full meal.
eat like a horse,To eat large amounts of food.
eat like an animal,"To eat large amounts of food, especially when in a greedy and sloppy manner."
eat like a pig,"To chew noisily, with one's mouth open, especially while consuming large quantities greedily."
empty as a pauper's purse,Completely empty.
face like a fiddle,A long face; a melancholy expression.
face like a smacked arse,The face of someone who looks depressed.
fair as the day,Very beautiful.
faithful as a dog,Extremely faithful.
faster than a minnow can swim a dipper,Very soon or quickly.
fat as a fool,extremely fat; porky
fat as a house,Very fat; plump; overweight.
fertile as a turtle,Highly fertile.
fight like cat and dog,To fight frequently or irreconcilably.
fine as frog hair,Extremely fine.
fit as a butcher's dog,Very fit; in good shape.
fit as a fiddle,Perfectly fit; in excellent condition or health.
fit as a flea,Very fit; in good shape.
fit as a lop,In good health; very fit.
fit like a glove,"To be a perfect fit, to be exactly the right size."
flat as a pancake,Particularly or extremely flat.
float like a butterfly,To move effortlessly and in an agile fashion.
fly like a rock,to travel through the air with little or no benefit from aerodynamic lift
free as a bird,Having no ties; completely free.
free as the wind,Having no ties; completely free.
fresh as a daisy,Very fresh; well-rested.
fresh as a rose,Extremely fresh.
fresh as paint,very fresh
fresh fucked fox in a forest fire,"Something which is extremely hot, in any sense."
fuck like a mink,To have sex with great enthusiasm.
fuck like rabbits,To have copious amounts of coitus.
full as a goog,Having eaten too much.
full as a tick,"Engorged with food or drink, especially alcoholic drink."
funny as a barrel of monkeys,Very funny.
funny as a dose of the clap,Not at all amusing.
gay as springtime,Overtly or flamboyantly homosexual.
gentle as a lamb,Very caring and calm.
get on like a house on fire,To immediately start a good relationship with someone.
giddy as a windmill,Very dizzy.
go down like a lead balloon,To be received negatively by others.
go down like a lead zeppelin,To fall precipitately; to plummet.
go down like a sack of potatoes,To fall hard and fast; to fall ungracefully.
go like a dream,to go extremely well.
good as gold,Of high and enduring value.
good as one's word,Faithful to a promise one has made.
good as wheat in the bin,"Perfectly good, sound, or reliable."
go out like a light,To fall asleep quickly.
go over like a lead balloon,To fail to gain acceptance: to be received poorly.
go over like a lead zeppelin,To be received negatively by others.
grave as a judge,Thoroughly serious.
green as a gooseberry,Young and inexperienced.
green as grass,Inexperienced or naive.
grin like a mule eating briars,To grin very widely.
grow like a weed,To grow rapidly.
guilty as sin,Unquestionably guilty.
happy as a clam,Very happy and carefree.
happy as a jaybird,Very happy and carefree.
happy as a lark,Very happy (sometimes with the extra connotations of being carefree or unaware of grimmer realities).
happy as a pig in mud,Very happy or content.
happy as a pig in shit,Extremely happy; obviously satisfied and carefree.
happy as a possum up a gum tree,Very happy or content.
happy as a prince,Thoroughly contented.
happy as a sandboy,Very happy.
hard as a rock,"Very hard (tough, inflexible); rock hard."
hard as brazil,Extremely hard.
hard as iron,very hard
hard as nails,Very unsympathetic; callous
hard as the nether millstone,Very callous or hardhearted.
healthy as a horse,Very healthy.
hearty as a buck,"Extremely healthy; extremely lively, high-spirited, or active."
heavy as a dead donkey,Very heavy.
herd cats,To attempt to control the uncontrollable.
high as a kite,Very much under the influence of drugs; extremely high.
high as giraffe pussy,Very high (intoxicated by drugs).
hoarse as a crow,Very hoarse.
homely as a hedge fence,"Having no physically attractive characteristics, but not blatantly ugly; very plain in appearance."
honest as the day,Thoroughly honest.
hot as blazes,Extremely hot.
hot as fire,Very hot
hot as hell,Extremely hot
hung like a donkey,Having a large penis.
hung like a horse,Having a large penis.
hungry as a hog,Very hungry
hungry like the wolf,ravenously hungry
innocent as a lamb,very innocent
innocent as a newborn babe,Entirely innocent.
innocent as the babe unborn,Entirely innocent.
innocent as the child unborn,Utterly innocent.
keen as a bean,Very keen; enthusiastic; eager.
keen as knives,Very keen or eager; avid.
keen as mustard,"Very keen, enthusiastic, eager."
kick like a mule,To have a very strong physical effect.
know like a book,To have an extensive and penetrating understanding of (something or someone).
know like the back of one's hand,To be intimately knowledgeable about something.
larger than life,Of greater size or magnitude than is naturally or normally the case; of larger size than life-size.
laugh like a drain,"To laugh with a loud, coarse sound"
laugh like a hyena,To laugh hysterically
leak like a sieve,To be very leaky.
lie like a cheap rug,To tell numerous or serious lies.
lie like a dog,To lie a lot; to tell many untruths.
life is like a box of chocolates,Life is full of surprises; you never know what will happen next.
light as a feather,"extremely light, having minimal weight"
like a bag of ferrets,"With a great deal of fuss, commotion, or physical jostling."
like a bat out of hell,With crazy or excessive intensity or speed.
like a bear with a sore head,Very irritable; bad-tempered.
like a blue-arsed fly,"To be frantic, harried or restless"
like a boss,"Skillfully, confidently."
like a bowl in a china shop,Misunderstanding or mishearing of like a bull in a china shop.
like a bull in a china shop,"Clumsy, aggressive, without care, concern or self-control."
like a bump on a log,"Idly, listlessly, or uselessly."
like a cat in a strange garret,Having a feeling of uncertainty and misapprehension due to being in an unfamiliar situation.
like a cat on a hot tin roof,"Jumpy, nervous."
like a charm,Very effectively.
like a cow pissing on a flat rock,Heavily; copiously (and often loudly).
like a dog in heat,"Very energetic and enthusiastic, especially when sexually aroused."
like a dog with a bone,Stubborn and tenacious; persistent; relentless; dogged.
like a dog with two dicks,Sexually voracious.
like a dog with two tails,Very happy and excited.
like a dose of salts,Very quickly and thoroughly.
like a drowned rat,Soaked to the point of being highly unattractive; bedraggled.
like a duck takes to water,Very naturally; without effort.
like a dying duck in a thunderstorm,Looking hopelessly sad and dejected.
like a fart in church,In a way that is very poorly received.
like a hawk,"With particular vigilance or attention, implying sharp vision."
like a hen on a hot griddle,Very jumpy or restless.
like a kid in a candy store,Extremely excited as a result of having many options to choose from.
like a knife through butter,With great ease and effectiveness.
like a lamb to the slaughter,"Helplessly and innocently, without knowing the unpleasant consequences."
like a man,"Bravely, decisively, and without complaining."
like a man possessed,In an energetic or uncontrolled way.
like a martin to his gourd,"Straight, unerringly, directly."
like a million bucks,Extremely good or well.
like a million dollars,extremely good or well
like a monkey on a stick,To be restless and agitated.
like a mother hawk,Paying extremely close attention; in an extremely protective way
like a moth to the flame,Inescapably allured by something harmful.
like an explosion in a paint factory,Riotously colorful.
like a pakapoo ticket,Very messily scrawled; illegible.
like a phoenix from the ashes,So as to return triumphantly.
like a raped ape,With great rapidity.
like a rat up a drainpipe,Very rapidly.
like a ripe plum,With no effort on one's part.
like a scalded cat,With great rapidity.
like a scalded dog,With great rapidity.
like a stuck pig,Like a pig or boar being slaughtered.
like atomic clockwork,With absolute regularity and precision; faultlessly.
like a ton of bricks,Very strongly; very heavily; often unexpectedly.
like a train,With unstoppable momentum.
like a wolf on the fold,In a sudden or aggressive manner.
like clockwork,With perfect regularity and precision; faultless.
like crack,Very addicting.
like crazy,"To a great or excessive degree; with great speed, output, enthusiasm, etc."
like death warmed over,"Ill, unwell."
like feeding time at the zoo,"Extremely frenetic, disorderly and messy."
like gangbusters,"Vigorously, rapidly, zealously, or forcibly; in a manner which has considerable impact."
like grease through a goose,Very fast.
like grim death,With savage determination or persistence.
like hot cakes,"Quickly, especially by purchase or consumption."
like it's going out of style,Of engaging in an activity: enthusiastically; to an excessive degree.
like kicking dead whales down the beach,Very slow and difficult.
like molasses,Very slowly and gradually.
like mushrooms,Very quickly and in great quantity.
like nobody's business,In an extreme manner; excessively; like crazy.
like one needs a hole in the head,not (needed) at all
like one o'clock,Very quickly or vigorously.
like one owns the place,With a sense of arrogant superiority.
like one's life depended on it,Desperately.
like peas and carrots,Getting along very well; being compatible; like a house on fire.
like rats from a sinking ship,"Quickly but futilely, away from a failing project."
like riding a bike,"Said of skill that, once learned, is never forgotten."
like shelling peas,"Repetitive, but very easy."
like shit through a goose,Very fast.
like shooting fish in a barrel,Extremely easy; sometimes with a connotation of triumph but at other times with a connotation of being meaningless and unsatisfying.
like stink,very hard
like stink on shit,In very close proximity; following closely.
like strange bulldogs,Wary and unfriendly; on the verge of a fight.
like taking candy from a baby,Very easy to achieve.
like talking to a wall,A futile or unsuccessful attempt at communication due to the ignorance or stubbornness of the other party.
like the back end of a bus,Very unattractive.
like the bottom of a birdcage,Very foul-tasting; said of a person's mouth after heavy drinking etc.
like the cat that got the cream,Very satisfied and happy.
like the clappers,Very hard or very rapidly.
like the new time,"Furiously or vigorously, repeatedly."
like the wind,"quickly, at a high speed."
like throwing a hot dog down a hallway,"Used to describe penetrative sex with a woman who has a large, spacious vagina."
like two peas in a pod,Very similar; a couple made for each other.
like water,Abundantly; consumed rapidly or found in great quantity.
like water off a duck's back,Without immediate or lasting effects.
like white on rice,In very close proximity; following closely.
like winkin,Very quickly.
like winking,Very rapidly; in a flash.
limber as a dishrag,Extremely limber or flexible
live like a fighting cock,To enjoy good food regularly.
live like a king,"To live in luxury, in costly and comfortable surroundings."
long as one's arm,Very long.
look as if one has been dragged through a hedge backwards,To look extremely dishevelled.
look like a bomb has hit it,to be very messy.
look like something the cat dragged in,To have a very dishevelled or untidy appearance.
look like who did it and ran,To appear messy or dishevelled.
loose as a goose,Very loose (in various senses).
lower than a snake's belly,Deeply low.
mad as a bear with a sore head,Very angry.
mad as a cut snake,"Very irate, crazy with rage."
mad as a hatter,Crazy or demented.
mad as a hornet,Extremely angry
mad as a meat axe,Very irate; crazy with rage.
mad as a mongoose,Demented or crazy.
mad as a wet hen,Very angry; furious.
make out like a bandit,To profit greatly; to get an excessively good deal
merry as a cricket,Very merry or cheerful.
merry as a grig,Very merry or cheerful.
midnight in a coal mine,A state of pitch-blackness.
mild as milk,"Very mild, in temperament or otherwise."
mind like a sieve,very poor memory
mind like a steel trap,A remarkably efficient mind; great skill in learning and/or reasoning.
miserable as a wet hen,Thoroughly miserable or dejected.
modern as next week,Thoroughly modern; completely up to date.
naked as a jaybird,"Stark naked; nude; especially, naked in a public setting and without embarrassment."
near as a toucher,Very close indeed; as near as possible without actually touching.
neat as a button,Very neat.
neat as a new pin,Very clean or tidy
neat as a pin,Very neat and tidy.
neat as ninepence,"Neat, tidy, in order."
nervous as a cat,Very nervous.
nervous as a long-tailed cat in a room full of rocking chairs,Extremely nervous.
nervous as a whore in church,Very nervous.
nice as ninepence,Perfectly all right; fine.
nice as pie,Very nice.
not as green as one is cabbage-looking,Not as naive or foolish as might be expected.
nuttier than squirrel poop,Very nutty; crazy.
nuttier than squirrel shit,Very nutty; crazy.
nutty as a fruitcake,"Behaving in an eccentric, foolish, or kooky manner; very nutty."
odious as a toad,Very odious; hateful.
off like a bride's nightie,Making a rapid departure; away.
off like a dirty shirt,Going away; taking one's departure.
off like a prom dress,"Making a start, or departing, very rapidly."
old as the hills,Extremely old.
old as time,Extremely old.
older than dirt,very old
original as sin,Very original.
out like a light,"Asleep or unconscious, particularly if this has occurred suddenly and the sleep is deep."
packed like sardines,Densely packed; tightly squeezed together; crammed.
pale as death,extremely pale
pale as milk,Very pale.
paper wall,"A thin wall, especially if poorly soundproof."
party like it's 1999,"To party intensely, particularly when reckless or pessimistic."
